nome,origem,prioridade,bônus_em,efeito_bônus,valor_bônus,condição,restrição_classe,restrição_raça,restrição_nível,restrição_poderes,restrição_divindade,restrição_perícia,restrição_magia,restrição_atributo,automático,referência,já_processado
Briga,Habilidade de Lutador,0,,atk desarmados dão dano bônus e podem matar,,Ataque Desarmado,Lutador,,1,,,,,,Sim,"Tormenta 20: Jogo do Ano, página 76",
Golpe Relâmpago,Habilidade de Lutador,0,,"ao atkar desarmado, page 1 pm para atk desarmado novamente",,Ataque Desarmado,Lutador,,1,,,,,,Sim,"Tormenta 20: Jogo do Ano, página 76",
Até Acertar,Poder de Lutador,0,ataque,"escolha um número X, caso acertar X atk desarmados o último têm +2*X em ataque",,"Escolher X, Ataque Desarmado",Lutador,,2,,,,,,,"Tormenta 20: Jogo do Ano, página 76",
Até Acertar,Poder de Lutador,0,dano,"escolha um número X, caso acertar X atk desarmados o último têm +2*X em dano",,"Escolher X, Ataque Desarmado",Lutador,,2,,,,,,,"Tormenta 20: Jogo do Ano, página 76",
Braços Calejados,Poder de Lutador,0,defesa,,"min(""atr:for"",  ""nível:Lutador"")",Não usar armadura,Lutador,,2,,,,,,,"Tormenta 20: Jogo do Ano, página 76",
Casca Grossa,Poder de Lutador,0,defesa,,"min(""atr:con"",  ""nível:Lutador"")",Não usar armadura pesada,Lutador,,3,,,,,,Sim,"Tormenta 20: Jogo do Ano, página 76",
Casca Grossa,Poder de Lutador,0,defesa,,"max(0, math.floor((""nível:Lutador"" - 3) / 4))",Não usar armadura pesada,Lutador,,7,,,,,,Sim,"Tormenta 20: Jogo do Ano, página 76",
Língua dos Becos,Poder de Lutador,0,,pague 1 pm para usar for ao invés de car num teste de car,,,Lutador,,2,,,Intimidação,,for:1,,"Tormenta 20: Jogo do Ano, página 76",
Coragem Total,Poder Concedido,0,,imune a medo (menos fobias raciais),,,,,1,,Arsenal|Khalmyr|Lin-Wu|Valkaria,,,,,"Tormenta 20: Jogo do Ano, página 133",